{
  "$id": "urn:wotex:profiles:schema:capture:1",
  "$schema": "http://json-schema.org/draft-07/schema#",
  "additionalProperties": false,
  "definitions": {
    "channel_plan": {
      "additionalProperties": false,
      "properties": {
        "affordance": {
          "additionalProperties": false,
          "properties": {
            "kind": {
              "enum": [
                "property",
                "action",
                "event"
              ]
            },
            "name": {
              "maxLength": 128,
              "minLength": 1,
              "type": "string"
            }
          },
          "required": [
            "kind",
            "name"
          ],
          "type": "object"
        },
        "channel_id": {
          "pattern": "^[a-zA-Z0-9._-]{1,128}$",
          "type": "string"
        },
        "conversion": {
          "oneOf": [
            {
              "type": "null"
            },
            {
              "additionalProperties": false,
              "properties": {
                "kind": {
                  "const": "affine"
                },
                "offset_d": {
                  "pattern": "^[1-9][0-9]*$",
                  "type": "string"
                },
                "offset_n": {
                  "maxLength": 20,
                  "pattern": "^(0|-?[1-9][0-9]*)$",
                  "type": "string"
                },
                "scale_d": {
                  "pattern": "^[1-9][0-9]*$",
                  "type": "string"
                },
                "scale_n": {
                  "pattern": "^[1-9][0-9]*$",
                  "type": "string"
                }
              },
              "required": [
                "kind",
                "scale_n",
                "scale_d",
                "offset_n",
                "offset_d"
              ],
              "type": "object"
            },
            {
              "additionalProperties": false,
              "properties": {
                "entries": {
                  "items": {
                    "additionalProperties": false,
                    "properties": {
                      "source": {
                        "$ref": "#/definitions/scalar"
                      },
                      "target": {
                        "$ref": "#/definitions/scalar"
                      }
                    },
                    "required": [
                      "source",
                      "target"
                    ],
                    "type": "object"
                  },
                  "maxItems": 256,
                  "minItems": 1,
                  "type": "array"
                },
                "kind": {
                  "const": "table"
                }
              },
              "required": [
                "kind",
                "entries"
              ],
              "type": "object"
            }
          ]
        },
        "definition": {
          "type": [
            "object",
            "null"
          ]
        },
        "disposition": {
          "enum": [
            "supported",
            "excluded"
          ]
        },
        "invalid_values": {
          "items": {
            "$ref": "#/definitions/scalar"
          },
          "maxItems": 32,
          "type": "array",
          "uniqueItems": true
        },
        "operations": {
          "items": {
            "type": "string"
          },
          "type": "array",
          "uniqueItems": true
        },
        "reason": {
          "type": [
            "string",
            "null"
          ]
        },
        "required": {
          "type": "boolean"
        },
        "selector": {
          "type": "object"
        },
        "semantic": {
          "$ref": "#/definitions/reference"
        }
      },
      "required": [
        "channel_id",
        "affordance",
        "semantic",
        "definition",
        "operations",
        "selector",
        "conversion",
        "invalid_values",
        "required",
        "disposition",
        "reason"
      ],
      "type": "object"
    },
    "data_schema": {
      "additionalProperties": false,
      "properties": {
        "additionalProperties": {
          "const": false
        },
        "const": {},
        "description": {
          "type": "string"
        },
        "enum": {
          "maxItems": 256,
          "minItems": 1,
          "type": "array",
          "uniqueItems": true
        },
        "exclusiveMaximum": {
          "type": "number"
        },
        "exclusiveMinimum": {
          "type": "number"
        },
        "items": {
          "$ref": "#/definitions/data_schema"
        },
        "maxItems": {
          "minimum": 0,
          "type": "integer"
        },
        "maxLength": {
          "minimum": 0,
          "type": "integer"
        },
        "maximum": {
          "type": "number"
        },
        "minItems": {
          "minimum": 0,
          "type": "integer"
        },
        "minLength": {
          "minimum": 0,
          "type": "integer"
        },
        "minimum": {
          "type": "number"
        },
        "multipleOf": {
          "type": "number"
        },
        "observable": {
          "type": "boolean"
        },
        "properties": {
          "additionalProperties": {
            "$ref": "#/definitions/data_schema"
          },
          "type": "object"
        },
        "readOnly": {
          "type": "boolean"
        },
        "required": {
          "items": {
            "maxLength": 128,
            "minLength": 1,
            "type": "string"
          },
          "type": "array",
          "uniqueItems": true
        },
        "title": {
          "type": "string"
        },
        "type": {
          "enum": [
            "null",
            "boolean",
            "integer",
            "number",
            "string",
            "array",
            "object"
          ]
        },
        "writeOnly": {
          "type": "boolean"
        }
      },
      "required": [
        "type"
      ],
      "type": "object"
    },
    "reference": {
      "additionalProperties": false,
      "properties": {
        "id": {
          "maxLength": 256,
          "minLength": 1,
          "type": "string"
        },
        "sha256": {
          "pattern": "^[0-9a-f]{64}$",
          "type": "string"
        },
        "version": {
          "pattern": "^(0|[1-9][0-9]*)\\.(0|[1-9][0-9]*)\\.(0|[1-9][0-9]*)$",
          "type": "string"
        }
      },
      "required": [
        "id",
        "version",
        "sha256"
      ],
      "type": "object"
    },
    "scalar": {
      "oneOf": [
        {
          "additionalProperties": false,
          "properties": {
            "type": {
              "const": "null"
            }
          },
          "required": [
            "type"
          ],
          "type": "object"
        },
        {
          "additionalProperties": false,
          "properties": {
            "type": {
              "const": "boolean"
            },
            "value": {
              "type": "boolean"
            }
          },
          "required": [
            "type",
            "value"
          ],
          "type": "object"
        },
        {
          "additionalProperties": false,
          "properties": {
            "type": {
              "const": "text"
            },
            "value": {
              "maxLength": 4096,
              "type": "string"
            }
          },
          "required": [
            "type",
            "value"
          ],
          "type": "object"
        },
        {
          "additionalProperties": false,
          "properties": {
            "type": {
              "enum": [
                "sint",
                "uint"
              ]
            },
            "value": {
              "maxLength": 20,
              "pattern": "^(0|-?[1-9][0-9]*)$",
              "type": "string"
            }
          },
          "required": [
            "type",
            "value"
          ],
          "type": "object"
        },
        {
          "additionalProperties": false,
          "properties": {
            "coefficient": {
              "maxLength": 20,
              "pattern": "^(0|-?[1-9][0-9]*)$",
              "type": "string"
            },
            "exponent": {
              "maximum": 32767,
              "minimum": -32768,
              "type": "integer"
            },
            "type": {
              "const": "decimal"
            }
          },
          "required": [
            "type",
            "coefficient",
            "exponent"
          ],
          "type": "object"
        },
        {
          "additionalProperties": false,
          "properties": {
            "base64": {
              "maxLength": 5464,
              "type": "string"
            },
            "type": {
              "const": "bytes"
            }
          },
          "required": [
            "type",
            "base64"
          ],
          "type": "object"
        }
      ]
    },
    "unit": {
      "additionalProperties": false,
      "properties": {
        "dimension": {
          "items": {
            "maximum": 32,
            "minimum": -32,
            "type": "integer"
          },
          "maxItems": 7,
          "minItems": 7,
          "type": "array"
        },
        "offset_d": {
          "pattern": "^[1-9][0-9]*$",
          "type": "string"
        },
        "offset_n": {
          "maxLength": 20,
          "pattern": "^(0|-?[1-9][0-9]*)$",
          "type": "string"
        },
        "quantity_kind": {
          "maxLength": 256,
          "minLength": 1,
          "type": "string"
        },
        "scale_d": {
          "pattern": "^[1-9][0-9]*$",
          "type": "string"
        },
        "scale_n": {
          "pattern": "^[1-9][0-9]*$",
          "type": "string"
        }
      },
      "required": [
        "quantity_kind",
        "dimension",
        "scale_n",
        "scale_d",
        "offset_n",
        "offset_d"
      ],
      "type": "object"
    },
    "value": {
      "oneOf": [
        {
          "additionalProperties": false,
          "properties": {
            "type": {
              "const": "null"
            }
          },
          "required": [
            "type"
          ],
          "type": "object"
        },
        {
          "additionalProperties": false,
          "properties": {
            "type": {
              "const": "boolean"
            },
            "value": {
              "type": "boolean"
            }
          },
          "required": [
            "type",
            "value"
          ],
          "type": "object"
        },
        {
          "additionalProperties": false,
          "properties": {
            "type": {
              "const": "text"
            },
            "value": {
              "maxLength": 4096,
              "type": "string"
            }
          },
          "required": [
            "type",
            "value"
          ],
          "type": "object"
        },
        {
          "additionalProperties": false,
          "properties": {
            "type": {
              "enum": [
                "sint",
                "uint"
              ]
            },
            "value": {
              "maxLength": 20,
              "pattern": "^(0|-?[1-9][0-9]*)$",
              "type": "string"
            }
          },
          "required": [
            "type",
            "value"
          ],
          "type": "object"
        },
        {
          "additionalProperties": false,
          "properties": {
            "coefficient": {
              "maxLength": 20,
              "pattern": "^(0|-?[1-9][0-9]*)$",
              "type": "string"
            },
            "exponent": {
              "maximum": 32767,
              "minimum": -32768,
              "type": "integer"
            },
            "type": {
              "const": "decimal"
            }
          },
          "required": [
            "type",
            "coefficient",
            "exponent"
          ],
          "type": "object"
        },
        {
          "additionalProperties": false,
          "properties": {
            "base64": {
              "maxLength": 5464,
              "type": "string"
            },
            "type": {
              "const": "bytes"
            }
          },
          "required": [
            "type",
            "base64"
          ],
          "type": "object"
        },
        {
          "additionalProperties": false,
          "properties": {
            "items": {
              "items": {
                "$ref": "#/definitions/value"
              },
              "maxItems": 256,
              "type": "array"
            },
            "type": {
              "const": "list"
            }
          },
          "required": [
            "type",
            "items"
          ],
          "type": "object"
        },
        {
          "additionalProperties": false,
          "properties": {
            "entries": {
              "items": {
                "additionalProperties": false,
                "properties": {
                  "key": {
                    "maxLength": 128,
                    "minLength": 1,
                    "type": "string"
                  },
                  "value": {
                    "$ref": "#/definitions/value"
                  }
                },
                "required": [
                  "key",
                  "value"
                ],
                "type": "object"
              },
              "maxItems": 256,
              "type": "array"
            },
            "type": {
              "const": "object"
            }
          },
          "required": [
            "type",
            "entries"
          ],
          "type": "object"
        }
      ]
    }
  },
  "properties": {
    "binding": {
      "$ref": "#/definitions/reference"
    },
    "capture_epoch": {
      "pattern": "^[0-9a-f]{32}$",
      "type": "string"
    },
    "digest": {
      "pattern": "^[0-9a-f]{64}$",
      "type": "string"
    },
    "fields": {
      "additionalProperties": {
        "oneOf": [
          {
            "additionalProperties": false,
            "properties": {
              "type": {
                "const": "boolean"
              },
              "value": {
                "type": "boolean"
              }
            },
            "required": [
              "type",
              "value"
            ],
            "type": "object"
          },
          {
            "additionalProperties": false,
            "properties": {
              "type": {
                "const": "text"
              },
              "value": {
                "maxLength": 4096,
                "type": "string"
              }
            },
            "required": [
              "type",
              "value"
            ],
            "type": "object"
          },
          {
            "additionalProperties": false,
            "properties": {
              "type": {
                "enum": [
                  "sint",
                  "uint"
                ]
              },
              "value": {
                "maxLength": 20,
                "pattern": "^(0|-?[1-9][0-9]*)$",
                "type": "string"
              }
            },
            "required": [
              "type",
              "value"
            ],
            "type": "object"
          }
        ]
      },
      "maxProperties": 64,
      "propertyNames": {
        "pattern": "^[a-zA-Z0-9._-]{1,128}$",
        "type": "string"
      },
      "type": "object"
    }
  },
  "required": [
    "binding",
    "capture_epoch",
    "fields",
    "digest"
  ],
  "type": "object"
}
