{
  "binding": {
    "id": "urn:example:binding:register",
    "sha256": "c18cc5f31d87c9b48322791f5f894e3e544de489777804b59aad93a5a1f80a1c",
    "version": "1.0.0"
  },
  "capture_epoch": "cccccccccccccccccccccccccccccccc",
  "digest": "2c4e32370c5c36b73693e64182518a59c0e17175e15a43b21aef2f0f5aa87808",
  "fields": {
    "model": {
      "type": "text",
      "value": "synthetic-industrial"
    }
  }
}
